{
  "schema_version": "1.0",
  "recording": {
    "sha256": "aaaaaaaaaaaaaaaaaaaaaaaaaaaaaaaaaaaaaaaaaaaaaaaaaaaaaaaaaaaaaaaa",
    "original_name": "sample.mp3"
  },
  "language": {"code": "en", "confidence": 0.98},
  "segments": [
    {
      "start": 0.5,
      "end": 2.0,
      "speaker": "SPEAKER_01",
      "text": "Hello field team.",
      "confidence": 0.91,
      "words": [
        {"text": "Hello", "start": 0.5, "end": 1.0, "confidence": 0.93},
        {"text": "field", "start": 1.05, "end": 1.4, "confidence": null},
        {"text": "team.", "start": 1.45, "end": 2.0, "confidence": 0.88}
      ]
    }
  ],
  "run": {
    "model": "large-v3",
    "compute_type": "float16",
    "created_at": "2026-08-11T20:00:00Z",
    "duration_seconds": 4.2,
    "peak_gpu_memory_mb": 8100
  }
}
